{
  "id": "exercise_09",
  "slug": "checkin-checkout",
  "title": "Check-in / Check-out",
  "goal": "Сделать ежедневную микропрактику осознанности и короткой рефлексии.",
  "week": 4,
  "target_skill": "reflection",
  "ybt_focus": ["Я", "Команда"],
  "duration_min": 3,
  "mode": "checkin",
  "badge": "Ритм практики",
  "level": "применяю",
  "summary": "Утренний и вечерний режимы со streak и мягким фидбеком.",
  "steps": [
    {
      "id": "mode",
      "kind": "singleChoice",
      "title": "Какой режим вы выбираете сейчас?",
      "options": [
        { "id": "checkin", "label": "Утренний check-in", "score": 5 },
        { "id": "checkout", "label": "Вечерний check-out", "score": 5 }
      ]
    },
    {
      "id": "energy",
      "kind": "rating",
      "title": "Какой сейчас уровень энергии?",
      "options": [
        { "id": "1", "label": "1", "score": 1 },
        { "id": "2", "label": "2", "score": 2 },
        { "id": "3", "label": "3", "score": 3 },
        { "id": "4", "label": "4", "score": 4 },
        { "id": "5", "label": "5", "score": 5 }
      ]
    },
    {
      "id": "focus",
      "kind": "text",
      "title": "Короткая фраза дня",
      "placeholder": "Что сейчас главное?"
    },
    {
      "id": "micro_commitment",
      "kind": "text",
      "title": "Микрообязательство",
      "placeholder": "Какой один шаг вы точно сделаете?"
    }
  ],
  "content": {
    "intro": "Микропрактика на 2-3 минуты с историей ответов и серией дней.",
    "caseLabel": "streak-enabled"
  },
  "scoring": {
    "base_points": 20,
    "bonus_points": 10,
    "penalty_points": 0
  },
  "feedback_rules": [
    {
      "id": "streak-build",
      "title": "Серия набирает ход",
      "predicate": "streak>2",
      "message": "Регулярность уже важнее идеальности ответов.",
      "recommendation": "Продолжайте держать один и тот же временной слот для этой практики."
    }
  ],
  "reflection_prompt": "Что вы замечаете про себя или команду после этой короткой рефлексии?",
  "admin_editable_fields": ["steps", "feedback_rules", "badge", "content"],
  "recommendation_48h": "Повторите практику в тот же временной слот завтра, чтобы не разрывать ритм.",
  "micro_experiment_prompt": "Держите check-in/check-out минимум 5 рабочих дней подряд и посмотрите на динамику энергии.",
  "week_theme": "Осознанность и регулярность"
}
