{
  "id": "exercise_10",
  "slug": "circle-of-responsibility",
  "title": "Круг ответственности",
  "goal": "Тренировать разделение на влияние, переговоры и то, что вне контроля.",
  "week": 4,
  "target_skill": "responsibility",
  "ybt_focus": ["Я", "Бизнес"],
  "duration_min": 5,
  "mode": "quiz",
  "badge": "Чистый фокус влияния",
  "level": "пробую",
  "summary": "Кейс с карточками, которые нужно разложить по трём зонам.",
  "steps": [
    {
      "id": "zones",
      "kind": "categorize",
      "title": "Разложите факторы по зонам",
      "buckets": ["Влияю напрямую", "Могу обсуждать и договариваться", "Вне моего контроля"],
      "cards": [
        { "id": "my_calendar", "label": "Мой календарь и фокус-слоты", "correctBucket": "Влияю напрямую" },
        { "id": "team_priority", "label": "Приоритет команды на спринт", "correctBucket": "Могу обсуждать и договариваться" },
        { "id": "market_shift", "label": "Резкое изменение рынка", "correctBucket": "Вне моего контроля" }
      ]
    },
    {
      "id": "next_step",
      "kind": "singleChoice",
      "title": "Какой следующий шаг зрелее?",
      "options": [
        { "id": "act", "label": "Выбрать один фактор влияния и один предмет переговоров на ближайшую неделю", "score": 10 },
        { "id": "panic", "label": "Продолжать крутить тревогу про всё сразу", "score": 1 },
        { "id": "wait", "label": "Ничего не делать до идеальной ясности", "score": 2 }
      ]
    }
  ],
  "content": {
    "intro": "После раскладки пользователь получает эталон и пояснение, где стоит действовать, а где перестать сжигать ресурс."
  },
  "scoring": {
    "base_points": 45,
    "bonus_points": 15,
    "penalty_points": 0
  },
  "feedback_rules": [
    {
      "id": "zones-clear",
      "title": "Фокус очищен",
      "predicate": "score>50",
      "message": "Вы лучше отделяете действие от бесполезной тревоги.",
      "recommendation": "На неделе формулируйте один шаг влияния и один предмет переговоров в каждом сложном кейсе."
    }
  ],
  "reflection_prompt": "Где в ближайшие 48 часов вам важно выбрать действие вместо тревоги?",
  "admin_editable_fields": ["steps", "content", "feedback_rules", "scoring"],
  "recommendation_48h": "Возьмите один текущий стресс-кейс и разложите его по трём зонам до первой реакции.",
  "micro_experiment_prompt": "Неделю подряд завершайте напряжённые разговоры формулировкой: что под моим влиянием, что обсуждаем, что отпускаю.",
  "week_theme": "Зрелая ответственность"
}
